{
  "projection_id": "projection.supply-network-state.0001",
  "projection_name": "supply_network_state",
  "projection_type": "state",
  "projection_version": "1.0.0",
  "source_event_offset": 128,
  "source_event_id": "evt.shipment-delay.0001",
  "materialized_state_ref": "state://supply_network/current/128",
  "scope": {
    "entity_types": [
      "factory",
      "supplier",
      "shipment"
    ],
    "event_types": [
      "shipment_delayed",
      "shipment_rerouted",
      "supplier_failed"
    ],
    "adapter": "supply-network"
  },
  "status": "ready",
  "statistics": {
    "entity_count": 42,
    "relationship_count": 65,
    "last_rebuild_ms": 94
  },
  "built_at": "2026-03-08T11:16:15Z",
  "updated_at": "2026-03-08T11:16:15Z",
  "metadata": {
    "adapter": "supply-network"
  }
}
